{
  "schema_version": "1.0",
  "task_ref": "AR-EXAMPLE",
  "task_revision": 3,
  "interaction_required": true,
  "activation": "agent-uncertainty",
  "decision_status": "pending",
  "reason": "Two implementation paths have materially different migration and rollback consequences.",
  "requested_by": "agent",
  "decision_request_ref": "AWG-EXAMPLE-DECISION",
  "tui_contract_version": "1.0",
  "created_at": "2026-09-18T12:00:00Z"
}
